review_text,review_rating
uindah betulsepanjang perjalanan jg sangat memukau,5
pantainya bagus n aman buat anak anak yang ingin ke pantai,5
pantainya kotor kamar mandi untuk umum tidak tersedia harus ke warung banyak sampah,2
bagus,5
ok,5
bagus rekomen,5
pantai yang indah,5
ke sini main banana mbot rborang,5
pemandangan indah banyak wahana permainan yang ekstrem,5
masuk pas pelabuhan kmobil tiket masuk korg parkir kmobil naik perahu korg aqua besar k ikan bakar kporsi toilet mandi k bab k kencing k jalanan menuju ke pantai bagus kecuali yang ke mutiara,5
cukup sekali dan tak akan lagi parkir mobil didepan ditarik k pas masuk kenloket ditarik lagi katanya yg didepan karcis masuk pelabuhanpadahal kami tidak lg mau ke pelabuhan per orang bayar k cukup terasa mahal kalo buat rombongan mana petugasnya malesan buat jaga pelayanan gak ramah dan pantaninyapun kecil mana kotor juga,1
pantainya nyaman untuk wisata keluarga ada wahana permainan air juga untuk kebersihan juga baik petugas kebersihan optimal hanya kebiasaan pengunjung untuk buang sembarangan aja yang masih banyak bandelnya untuk tempat makan lumayan karena belum nemu makanan yang beneran enak dan cocok,5
sayang banget ke sini waktu mendung tp mendungmendung begini cakep si wkwkwkk,5
akses mudahnamun sayangnya pengunjung kurang sadar tentang sampahnyadi tinggalkan begitu saja di tempat mereka istirahat ngumpulmeskipun di dekatnya ada tempat sampah yg sudah di sediakankalau di tegur malah mlilikakhir e tak culekhhhmmmm,4
pantai murah meriah makanan enak banana boat rb lumayan lama durasinya orangnya ramah,5
pantai nya bersih recomend buat ngajak bocil,5
pantai tenang dan indah,4
kedatangan ke kalinya ke pantai ini air bersih pasir lembut buat mainan krn sampe masih pagi viewnya cakep banget cuaca sangat mendukung kamar mandi disini bersih mostly disini paling suka naek perahu mengelilingi pulau mutiara tarif korg,5
area camp jam pagi harus sudah bersih,5
pantai bagus bersih,5
bagus pantainya ombaknya sedang ruame poll pas datang antrinya udah panjang kalo naik bis kadang gabisa masuk parkir penuh harus naik angkutan lagi tp seru sih meskipun waktu jemput balik nya harus nunggu lumayan lama mungkin bisa di tambahin fasilitas nya untuk tempat sampahnya di mutiara sama toiletnya biar ngga terlalu antre lama ya kak overall bagus sih apalagi pemandangannya menuju pantainya cakep poll,5
bagus tapi banyak sampah tolong kebersihannya diperhatikan yaa permainannya seru tiketnya jg lumayan murah klo ksna pas wekend ramee bgt lama antri parkirnya,5
seru pokoknya,5
pemandangan bagus dan dapat angle view lain yang lebih keren dari pantai yg ada di trenggalek namanya liburan panjang pasti ramai pengunjung tapi jika antri jam buat masuk loket itu sudah sangat amat menyebalkan apalagi yg datang dari jauh dan waktu untuk menikmati jadi berkurang kedepannya bisa ditambahkan loket lagi atau bisa ditambahkan ojol untuk menjemput orang yg parkirnya jauh dari pantai tolong lebih dijaga untuk kebersihan pantai dan tempat sampah para pengunjung yang sudah penuh dan tidak ada penanganan dari pihak pengelola,3
meskipun jauhgk rugi pantainya bagus,5
baguss pantainya tapi ramee bengettt,4
saya pernah ke sini terus tempat nya indah banget terus pemandangan nya cantik,5
pantainya bagus asridan tidak ada sampah berserakan,5
kayak pulau merah di bayuwangi ada pulau karang di depan area pasirnya sempit jadi kayak terlalu rame tapi sepertinya di sebelahnya yg agak luas tapi jalannya masih batu overall lumayanlah dengan tiket rb per orang parkir mobil rb,4
pagi sejuk dan malamnya syahdu,5
pantai nya bagus bangett ombaknya gak terlalu besar di pinggiran pantai ada batu besar cocok buat foto aestetic buat piknik sangat oke di sekitaran pantai banyak pohon dan tempat buat berteduh kalau mau sholat gausah bingung karena sudah disediakan mushola di dalam rumah makan,5
salah satu destinasi pantai terbaik di sepanjang jls tulungagungtrenggalek,5
karena cuaca dingin,5
pantai bersih jalannya yaa begitulah kesana pakai driver yang pro ya,4
terlalu ekspektasi tinggi sama ini pantai hasilnya ya gitu tapi its ok lahh waktu kesana air lagi pasang gak bisa dinikmati anak lokasi jalannya sdh ok baik lewat trenggalek ato pun lewat jls gemah tulungagung,3
makasih,5
terdapat wahana babana boat perahu banyak terdapat warung makan tempat bilas dan sholat,5
indah nyaman,5
htm rb orgada warung dan toiletbisa untuk berenangposisi yg pantai dibalik bukit lebih lengang dr pd yg dekat parkir,5
waktu sunset bagus bgt tp area pantai kotor kurang bersih untuk ikan cumi asap lumayan enak,4
perjalanannya jauhh dan mantap sekali biaya parkir plus tiket masuknya k soalnya kemarin aku boncengan orang tapi minusnya wc toilet nya agak sempit,4
pantai enak buat seruseruan bareng keluarga,5
pantainya bagus enak buat acara ramerame bareng keluarga,5
pantai yg indah nyaman dan bersih,5
sayangnya kalau malam sampah nya tidak di bersihkan jadi kotor,4
mantap tapi sedikit rame,5
pantai mutiara trenggalek liburan nyaman lautan tenang ingin menikmati pantai indah dengan akses mudah dan fasilitas lengkap yuk kita ke pantai mutiara trenggalek pantai ini cocok banget untuk liburan keluarga rombongan atau healing sendiri dengan suasana tenang pemandangan laut yang memukau dan banyak fasilitas penunjang pantai ini siap bikin liburan kita jadi tak terlupakan akses menuju pantai mutiara sangat bersahabat lokasinya bisa dijangkau mobil pribadi maupun bus besar cocok untuk rombongan wisata atau keluarga besar tempat parkirnya luas jadi nggak perlu khawatir rebutan tempat saat ramai pengunjung jalannya pun halus dan nyaman dilalui tanpa medan sulit di sekitar pantai sudah tersedia homestay yang nyaman untuk menginap jadi kita bisa menikmati suasana pantai lebih lama tanpa harus buruburu pulang bangun pagi langsung lihat laut bisa banget yang bikin betah di kawasan pantai mutiara juga banyak warung yang menyajikan masakan laut segar mulai dari ikan bakar cumi hingga menu khas pesisir yang menggugah selera harganya terjangkau rasanya nikmat dan suasananya santai makan dengan view pantai itu memang tiada duanya jadi kalau kita cari tempat liburan yang aksesnya gampang fasilitasnya lengkap dan pemandangannya indah pantai mutiara trenggalek jawabannya yuk rencanakan liburan kita sekarang dan nikmati tenangnya laut serta hangatnya sambutan khas pesisir,5
terganggu dengan pengumuman masalah parkir mobil tolong diperbaiki masalah perkiran biar tidak sedikit pengumuman plat mobil terus menggangu boss,3
parkiran luas nyaman utk anak bermain air utk kebersihan tlg d tingkatkan lagi,4
pantainya bagus ramai banyak warung toilet ada mushola ada mobil elf bus bisa semua pantai nya ada yg satunya jalan kaki karena jalannya tanah berbatu rusak tpi pemandangannya jauh lebih indah pantai yg ke sepi bnyak pohon kelapa,5
lumayan bersih dan pemandangan nya bagus,4
kamis feb jalan mudah masuk wilayah pantai jln kyk cor gitu nyampe sana jam belum ada yg jaga loket masih sepi banget jadi langsung masuk aja jalur pantai mutiara dn berhubung ada himbauan g boleh parkir di bahu jalan terlanjur masuk mobil gak bisa putar alhasil nyusurin jln ada plang mutiara lanjut naik ampun dah ekstrim jln nya berbatu ber lobang syukur di bawah luas parkir mobil aman gak lama penjaga loket datang htm per orang rb parkir rb klo gak salah lumayan mahal kalo buat rombongan padahal week day,1
kurang bagus,1
sunset nya cakep,5
pantai yang cukup direkomendasi kan untuk di kunjungi plus ada speed boat banana boat jadi bikin seru banget banyak warung dan toilet jadi gak khawatir kalau mau buang air atau beli makanan dan minuman ada tempat penginapan bagi yang mau menginap ada ayunan juga bisa jadi spot foto minus banyak sampah bertumpukan di mana jadi kalau lagi makan gak selera tempat parkir penuh dan sumpek,4
kesini waktu weekday dan bukan hari libur nasional jadi tidak ramai terdapat warung dan penginapan toilet dan tempat bilas juga tersedia berbayar semoga kedepannya lebih bersih lagi,5
full of memories,5
bagus,4
pantai cantik bersih pasirnya banyak warung yg mnyediakan makanan laut dg harga murah banyak home stay harga terjangkau spot mancing juga oke,5
familiar untuk tempat bermain anak,5
sangattt bagus,5
salah satu hal yang paling menarik dari pantai mutiara adalah suasananya yang tenang dan alami pantai ini relatif kurang ramai dibandingkan dengan pantaipantai lainnya sehingga cocok untuk anda yang mencari kedamaian dan ingin menikmati keindahan alam tanpa gangguan terdapat spot pantai yaitu pantai mutiara dan pantai mutiara fasilitas di pantai ini cukup memadai dengan beberapa warung makan yang menawarkan hidangan laut segar dan lezat anda juga bisa menemukan tempat parkir yang luas serta beberapa gazebo yang bisa digunakan untuk bersantai sambil menikmati pemandangan laut aktivitas yang bisa dilakukan di pantai mutiara sangat beragam mulai dari berenang berjemur di pantai hingga snorkeling untuk melihat keindahan bawah laut bagi yang suka berpetualang terdapat juga jalur trekking yang mengarah ke bukitbukit sekitar pantai di mana anda bisa menikmati pemandangan yang lebih spektakuler dari ketinggian namun perlu diingat bahwa akses menuju pantai mutiara sedikit menantang karena jalannya yang berliku dan berbatu disarankan untuk menggunakan kendaraan yang memadai dan berhatihati selama perjalanan secara keseluruhan pantai mutiara trenggalek adalah tempat yang sangat direkomendasikan untuk anda yang ingin menghabiskan waktu liburan dengan suasana pantai yang tenang dan indah jangan lupa membawa kamera untuk mengabadikan momenmomen indah di sini,5
tempatnya bagus,5
pantai indah jalan menuju kesana sdh baik tapi pastikan kondisi kendaraan prima ombak relatif aman utk anak bermain di tepi pantai penginapan jg banyak makanan jga banyak tersedia banyak wahana air jg speed boat kapal rumah laut di tengah parkir klo wktu ramai lumayan luas,5
kondisinya beda jauh dg ke pantai yogya gunung kidul untuk bermain air kejernihan air lautnya luas landai pasirnya dsb sangat memadai di pantai gng kidul,1
menyenangkan,5
tempatnya lumayan bagus ombaknya tenang cocok untuk dibuat renang baik bagi anak kecil ataupun orang dewasa airnya agak pucat tapi yaudah sih perjalanan kesini kalau pakai gmaps sih pertengahan agak sulit karena jalan yang tidak rata tetapi ketika sudah memasuki jls perjalanan menjadi lebih mudah mulus saat saya berenang saya sempat menemukan popok bayi disini setelah itu saya langsung pulang karena popoknya bikin saya ga nafsu lagi buat renang mungkin next time bakal coba pantai di sebelahnya karena lebih sepi dan terlihat lebih bersih juga,4
seruu bgtdan pemandangan bagusspegunungan,5
josss,5
pertama x kepantai yg airnya tenang bisa buat berenang,5
pantai sangat indah bersih pemandangan yg sungguh takjub gunung dan bukit cocok untuk anak mandi ombak tk terlalu besar buat spot mancing murah meriah rb tiket masuk k parkir cuma rb mobil jam home stay murah meriah bersih,5
pantainya bersih air beningpasir bersihakses jln mudah nyaman,5
bagus bgt sii berangkat mlm sampe sana pagi masih sepi baguss bgtt,5
tidak terlalu luas tetapi nyaman untuk keluarga,5
mutiara itu tersembunyi dalam cangkang kerang begitu juga mengapa pantai ini diberikan nama mutiara ya karena cukup tersembunyi lokasinya masih di seputaran prigi tepatnya di timur selatan tenggara yang cukup tersembunyi jalan aksesnya cukup sempit tidak bisa simpangan tetapi untuk mobil elf hiace masih bisa dilokasi parkiran juga memadai panjang pantainya tidak seberapa tetapi bersih tenang dan teduh teduh oleh karena banyak pohon rindang juga berada di balik bukit di sisi timur kalau di pantai prigi angin dan ombak cukup besar namun di sini justru kebalikannya pantainya pasir putih yang sangat landai anginnya sepoisepoi dan ombaknya tenang untuk bermain air memancing atau mencoba banana boat menjadi lebih aman dan nyaman apalagi pemandangan di seberang barat teluk kesannya seperti sudah beda pulau padahal masih di lokasi yang sama disini juga bisa camping tetapi tenda hanya diijinkan berdiri sore hari sampai pagi saja fasilitas warung makan penginapan kamar mandi toilet sangat baik jadi menurut pendapat saya inilah pantai terbaik di pesisir selatan pulau jawa,5
pemandangan indah,5
asri parkiran luas bus besar bisa masuk,4
bolehlah,4
kesini tgl tahun baru banget dan rame bgt sampe ngga ada spot foto karna emng serame itu tapi wort it bgt bisa berenang disini karna ombaknya tenang dan bagus bgt,5
healing santuy dan nyaman disini,5
top markotob,5
salah satu pantai tercantik di jawa timur ada di trenggalek yaitu pantai mutiara dengan view perbukitan gunung selatan ada wahana banana boat k perorang ada jetsky k per menit area parkir cukup luas warung banyak akses cukup mudah via trenggalek atau via jls tulungagung sukses teruss desember,5
pantai nya indah tp sayang untuk camping tenda harus bayark tidak seperti pantai balai kambang looss,5
enak buat mancing,5
penuhh pengunjung sampek bingung mau ngecam,4
alami blom rame,5
pas weekend rame banget pantainya banyak batunya kurang aman untuk anak anak,4
baik,5
pantai yang bersih dan ntaman,5
pengen main sana lagi,5
tempatnya bagus beberapa toilet bersihmakanan enak enakcuma pengunjung perlu diedukasi lagi supaya menjaga kebersihanterutama buat sampah yang ditinggalkan,4
pantai pasir putih yang bersih sejuk dan nyaman,5
suka camping bersama keluarga,5
masyaallah suasana jauh dari kota perpaduan gunung dan laut,5
aksesnya sudah sangat mudah untuk dijangkau kalau lewat jls tulungagungtrenggalek pantai yang selalu rame karena bisa dinikmatin dan diceburin tapi tentu dengan batasan dab pengawasan ya,4
jalur lintas selatan,5
kali kesinikrna emang tempatnya aman untuk anak main air dipantaiuntuk camp nya juga murah bgtnext malming kesini lg,5
pantainya bersih enak buat camping,5
pantainya nyaman terasa sejuk dan eksotis,5
vief ter good si,5
seru banget baru sekali kesini rasanya pingin kesana lagi recomended berangkat malem jd sampai lokasi shubuh cocok buat nge grill sama camping piknik juga karena semakin siang semakin rame pengunjung nya,5
waktu berkunjung kesini suasananya ramai pengunjung beserta kendaraannya bisa dikatakan over juga untuk pesisir pantai awal masuk itu airnya sampai jadi keruh nah tapi yang dibalik batu itu airnya masih agak jernih lebih baik daripada sebelah hehehe jangan khawatir kalau lapar ada penjualnya ada kamar mandinya juga tentunya,4
suana pagi serasa bebas main dipinggir pantai tapi dijam keatas mulai banyak kapal kapal yg sandar buat angkut wisatawan yg ingin jelajah sekitar pantai para pengunjung nya banyak yg blm sadar akan kebersihan semoga kedepan tdk rusak karena tercemar sampah,4
baru pertama kali kesini ke pantai mutiara di trenggalek tgl nov akses dr sidoarjo kesini aman kami rombongan naik bus kecil jalanannya sudah bagus bus bs langsung masuk dan parkir didekat pantai kami sampai pukul jd masih lumayan sepi dan feel free mau aktivitas game atau apapun semakin siang smakin banyak pengunjung pantainya bersih bisa banget kalo mau naik perahu mengelilingi pantai mutiara kalo gk salah rb untuk orang banana boat untuk orang jetski jg adtp gatau brp xixixi disekitaran pantai banyak penjual dan toilet umum untuk mandidll,5
untuk pantainya bersihcocok buat mantai sama anak jugaparkiran mencukupicuma untuk harga makanan dan snack dsini agak mahal dibanding pantai prigi dan sekitarnyasewa tikar rb tapi harus deposit rblebih baik kalau kesini membawa perlengkapan sendiri,4
pnti pling nyamn untuk dikunjungi banyak tempat teduh nya dan kuliner juga,5
laut bebatuan membuat kaki terluka pelayanan lambat,1
pantai nya bagus tenang recomended,5
indah di buat liburan untuk brwisata pantai,5
arus air yang tenang sangat cocok untuk berenang bagi anak dalam pantauan orang tua banyak spot untuk mancing juga buat yang hoby mancing,5
suasananya asyikkk,5
htm k per orang dengan view g terlalu baguus diri in tenda di mintai uang kebersihan k per tenda itu menurut saya sangat sangat mahal jadi tenda kena k dan gak boleh di tawar pas liat kwitansi kwitansi kosongan nominalnya juga di isi sendiri cok cok nyesel gw kepantai mutiara,1
pantainya sungguh cantik sekali sungguh instagrammable sekali disini kalo mau menyusuri pantai disediakan persewaan jet ski menit rp ada banana boat juga atau kalau mau naik perahu bareng juga bisa saya kesini nemenin mama saya reunian bersama teman smpnya rame bus disini bisa jajan sepuasnya ada wc umumnya di setiap warung makannya yang tentu saja bayar ya kalo sore pasti indah sambil liat sunset,5
lumayan bersih dan aman,4
ke sini kalau hari minggu harus dateng lebih awal full padet pengunjung banyak warung yang jualan enak juga untuk mobil motor bisa parkir deket pantai tiket perorang naik perahun perorang naik banana perorang jetsky menit,5
trip by cv viza rentcar malang,5
minggu oktober salah satu pantai yang cocok untuk rekreasi keluarga karena pantai ini berada di teluk karanggongso so ombaknya pun kecil selain pantai yang bisa untuk berenang untuk anakanak ada wisata perahu mengelilingi teluk k per orang atau k per orang banana boatkorang k per unit untuk orang donat boat k orang atau k unit sky boat k menit untuk oleholeh disini banyak pedagang cumicumi asap ikan asap dll murah meriah tentunya,5
indah harga makanan standar,4
nyaman bersih recommended,5
sebenarbya enak lho pantainya cocok banget buat anak kecil karena ombaknya g besar trus g panas dipantai ada beberapa lokasi kalo yg pantai utama yaa rame banget full orang parkiran juga luas sekaliii nnti parkir harus siap mendengarkan info dr petugas jika butuh mindah mobil atau lainnya ya pokoknya recomended,5
pantai mutiara merupakan serangkaian pantai yang ada di kawasan teluk prigi di pantai mutiara ini dapat di gunakan untuk camping karena ada campgroundnya di pantai mutiara ini banyak sekali homestay jadi tidak perlu kwatir soal penginapan di pantai mutiara ini petugas kebersihan di pantai mutiara ini sering keliling untuk membersihkan pantai ini dari sampah yang berserakan pantai mutiara ini mulai ramai daripada pantai karanggongso di pantai mutiara ini ada banana boat perahu dan wahana air lainnya selain kita menikmati keindahan alam,5
viewnya baguss bangett,5
pertama kali berwisata ke trenggalek langsung menuju pantai mutiara akses jalannya bagus dan mudah ditemukan bus pun bisa lewat untuk harga makanan standar ya saya pilih warung makan yang sudah tertera harganya fasilitas lengkap nggak perlu bingung banyak homestay bahkan bisa menginap menggunakan tenda jam pagi tenda harus dibongkar tenda pribadi dikenakan biaya ada penyewaan tenda juga di warung sini happy menginap view laut permainannya ada speed boat banana boat jet sky cocok untuk liburan keluarga dan rombongan tiket masuk per orang untuk mobil,5
pemandangan bagus aman untuk keluarga campung ground di jamin aman,5
gak cocok buat camping ada petugas malam yg minta ribu buat kebersihan pake kwitansi toko ntah itu beneran atau pungli kalau bener y diperbaiki pake karcis atau nota resmi giliran ditanya kok pake kwitansi toko malah marah,1
tempatnya bagus ombak relatif tenang masalahnya sampahdan akses kurang memadai,5
alhadulillah,5
buat yang mau kesini terutama berencana untung camping disini waspada dengan yang jaga malam orangnya gak jelas emosian arogan narik uang camping pas ditanya kok pake kwitansi toko gak kayak karcis resmi eh malah ngamuk padahal sebelum ngamuk udah tak bayar duluan ya wajar lah pengunjung cari informasi yang jelas ini malah bukannya dijelasin dengan baik malah marah,1
bagus selama perjalanan bisa lihat berbagai pantai sebelum sampai di pantai ini pemandangan di perjalanan sangat apik ngga terlalu luas pantainya tami recomen sih kalau punya anak aman asal ga terlalu ketengah harus slalu diawasi ya bund,5
hari jumat tgl september brangk jm stgh dr jombang nyampe mutiara isyak trs dirikan tenda skitar jm malam didatengin orang namanya dwi cahyo ato siapa lupa kita dimintain per tenda alesannya kebersiahantp dr cara dia narik bikin was was tiba jongkok nulis tarip saya inisiatif rekam dia trus kita tanyak biaya buat apa dia bilang biaya kebersihanok saya kasih tenda ng taunya dia marah karna saya rekamdia nanyak ng usah direkam gt mas saya petugas hargai saya gmn kalonmas jd saya trus saya rekamya saya jwb ng apa mas wong saya petugas dia jwb kalo saya ya ng trima direkam lah katanya saya ditanya bila jd petugas gmn kalo direkam ya saya ng apa disitu kita debat lama hmpir mntan gara dia ng trima saya rekamsaya bilang biar kalo ada hal yg diluar dugaan bisa jd bukti misal ada apa dia makin marah katanya saya disini petugas hargai sayasaya jg smpet kesel mas saya ini tamu jd hargai saya misal inii pantai anda saya ng akan rekam andadan ini fasilitas umum seharusnya mas yg hargai sayadisitu makin panas akhirnya dia didorong sama istri udah mas sana pergi saya ini liburan jgn bikin hilang moodintinya saya ng akan kesini lagi jelek bgt akhlak orang itusemoga yg mau camp hati jgn kaget kalo dia tiba jongkok narik duit,1
pantai ini sebelahan sm pantai pasir putih cuma terhalang batuan ajahtdk begitu luasbanyak bebatuan dibibir pantaitdk sebiru pantai pasir putih disebelahnyakesini pas sore hariyg bikin q kagumq bisa menikmati senja yg indah dipantai inisangat istimewa sekalirasanya g pengen beranjak dr bibir pantai,5
bagus murah,5
untuk view vibe dan water sport ok keren hanya perlu ada tambahan kamar mandi air bersih dan tempat parkir semoga ada pembenahan dan perluasan tambah warung makan juga lebih asik untuk kulineran,4
pantai yang indah dan bersih sempatkan diri mampir ke pantai ini kalau lagi ke trenggalek atau tulung agung,5
pengeloloan kawasannya kurang bagus dpt dilihat dr parkir yg gk tertib serta suara petugas yg sangat berisik yang menyeru pengunjung pake toa harga makanan yg relatif mahal untuk tempat pelosok,2
untuk camping tidak bagus sangat burukk salah satu penjaga yg menarik uang kebersihan prilakunya buruk tidak sopan pemberitahuan seperti pembongkaran tenda tidak ada pemberitahuan dari awal kecewa berat tidak mau kesana lagi saya udah jauh dateng terus untuk kamar mandi di kunci tidak sampai pagi,1
pantai bagus cocok untuk keluarga sunsetnya juga oke saran kalau datang jgn pas pasang atau sekitar tanggal jawa,5
mantab,5
pantai nya bagus lumayan bersih bisa mandi di pantaj saran aja kalau kesini jangan weekend atau weekday karena akan penuh sesak tiket masuk rb orang jalan sudah enak lewat jalur jls parkir luas asal bukan weekendweekday banyak warung tinggal pilih musholla toilet sudah tersedia next kesana lagi,5
pantainya bersih dg pasir putih yg halus enam kali kesini ombaknya selalu tenang tempat yg cocok buat camping dg keluarga tapi sayang tenda jam pagi harus sdh di lipat padahal kita butuh tempat utk menaruh barang perlengkapan saran mohon disediakan area utk camping ground,5
saat datang masih terlalu pagi jadi airnya masih surutblm terlalu naik sehingga keliatan bebatuannya yg ada di pinggiran pantai yg justru menampilkan daya tarik tersendiri,4
pemandangan sangat cantikuntuk makanan banyak pilihan beragam wahana air yg bisa dinikmati,5
pantainya bagus fasilitasnya juga lengkap ada warung makan dan homestay ada juga banana boat dan perahu untuk berkeliling,5
pantai mutiara sih lebih bagus,5
luar biasa indahnya,5
bagus biasanya jalan pas weekday jadi pas weekend kesana agak kaget dengan banyaknya pengunjung,5
nyaman untuk main anak anak cukup bersih pantainya cuma harus pinter milih tempat bilas wahana ada banana boat jetski juga perahu,5
makin ramai asyik buat main ramai tiket masuk masih murah korang,5
seru,4
