review_text,review_rating
site istimewa tapi tidak terawat ada warung kopi milik penjaga tiket sayang sekali perhutani tidak merawat site ini tiket masuk ribu,5
tempat ini sudah agak terbengkalai sepertinya orang daerah sini sudah bosen untuk berkunjung kesini tapi sebetulnya tempat ini sangat bagus ya alami natural sejuk dan instagramable banyak sekali spot buat fotoan disini pas kesini aku sendirian tidak ada pengunjung lain sama sekali sampai heran aku padahal tempat seindah ini kok jadi kayak terbengkalai tempatnya luas ya banyak yg bisa di eksplor,5
tempat ini pemandangannya biasa saja saya berangkat dengan teman saya dari probolinggo ke trenggalek butuh waktu sekitar jam dan gk worth it untuk ke sini apalagi saya akhir pekan ke sini pengunjungnya sangat membludak,4
jos,5
cantik dan alami banget tempatnya menurutku penuh dengan bebatuan yg keren bahkan beberapa titik mirip dengan batu karst di maros viet thai jalurnya explorenya cukup aman ada beberapa titik area juga yang bisa kalian explore dengan spot utamanya di jembatan sungai suasanya sekitarnya juga sejuk jadi nyaman menikmati suasana tapi saat ini mungkin butuh bantuan pemda sekitar juga untuk renovasi beberapa spot duduk warungnya dan juga membantu menarik minat para wisatawan untuk berkunjung ketempat ini dengan menambah fasilitasnya,5
one of the best spot in trenggalek,5
wisata bebatuan sesuai namanya taman batu ngerit,4
pemandangan indah seperti sebuah tempat yang terbuat oleh alam langsung,5
suasana trenggalek,5
bagus banget dan sangat rekomen banget cuma butuh penanganan lebih dan dibagian lokasi saran saya diberi pos jaga,5
tempatnya bagus banget bener hidden gem belum banyak yang tau luas dan seru buat dieksplore staffnya juga ramah semua tiket masuknya weekend orang jembatannya agak karatan tapi masih kuat dan oke yang penting gak muat banyak orang aman hati kalau kesana naik mobil pake google maps mending ikut jalur utama aja aspal soale kalo ikut maps dilewatin jalur pedalaman,5
tiket masuk tutup jam sore lumayan luas kami menghabiskan waktu sekitar menit dengan jalan agak cepat dan tidak berlamalama di spot karena kemarin datang mepet waktu tutup may take longer if you take your time there view was breathtaking secara keseluruhan dimaintain dengan baik bersih hanya saja ada beberapa spot yang tidak dibukatidak dapat dilewati karena belum diperbaiki kami membawa anak usia semua aman bisa dilalui dengan mudah ada beberapa spot yang agak susah dilalui anak usia lebih muda seperti tangga batu yang terlalu tinggi tapi bisa dilewati banyak spot lain yg menarik di dalam bisa jalan sendiri atau ditemani pemandu wisata dengan bayaran seikhlasnya di depan pintu masuk ada warung jajanan saung dan mushola,4
sudah mulai kembali alami,3
this place offers a unique blend of nature history and exploration that will leave you in awe its an ideal destination for nature lovers adventure seekers and anyone looking to uncover the hidden treasures of east java make sure to include this captivating cave in your travel itinerary,5
keren bangettt goanya batu batunya seperti disusun tapi sumpah bagus banget ini destinasi wajib kayaknya klo ke trenggalek tolong bantu viralkan ya bapak penjaganya juga ramah bangettt,5
wisata edukasi yang potensial di trenggalek saat ini masih minim perawatan dan jalan masih kurang accesible,4
pemandangan alam yang alami goa batuan udara sejuk,5
sayangnya kurang terawat,5
aman,1
ok,5
tempatnya bagus apalagi bebatuannya alami indah bgt goanya juga keren,3
tempatnya exotis seperti di belahan bumi yg lain,5
kewl,5
yukz br pariwisata alam,5
ngaji sore dan buka berkah di masjid syeh musa ngantru trenggalek jatim one day one hadits ahad maret ramadhon puasa ramadhan bagian dari jalan mudah masuk surga dari abu abdullah jabir bin abdullah al anshary radhiallahuanhuma seseorang bertanya kepada rasulullah shollallohu alaihi wa sallam seraya berkata bagaimana pendapatmu jika saya melaksanakan shalat yang wajib berpuasa ramadhan menghalalkan yang halal dan mengharamkan yang haram dan saya tidak tambah sedikitpun apakah saya akan masuk surga beliau bersabda ya riwayat muslim pelajaran yang terdapat di dalam hadits setiap muslim dituntut untuk bertanya kepada ulama tentang syariat islam tentang kewajibannya dan apa yang dihalalkan dan diharamkan baginya jika hal tersebut tidak diketahuinya penghalalan dan pengharaman merupan aturan syariat tidak ada yang berhak menentukannya kecuali allah ta ala amal saleh diantaranya puasa merupakan sebab masuknya seseorang kedalam syurga keinginan dan perhatian yang besar dari para shahabat serta kerinduan mereka terhadap surga serta upaya mereka dalam mencari jalan untuk sampai kesana tema hadits yang berkaitan dengan al quran evaluasi diri muhasabah hai orangorang yang beriman bertakwalah kepada allah dan hendaklah setiap diri memperhatikan apa yang telah diperbuatnya untuk hari esok akhirat dan bertakwalah kepada allah sesungguhnya allah maha mengetahui apa yang kamu kerjakan al hasyr rindu syurga dan bersegeralah kalian kepada ampunan dari tuhan kalian dan kepada surga yang luasnya seluas langit dan bumi yang disediakan untuk orangorang yang bertakwa ali imran dengan kata lain puasa itu membersihkan menyucikan dan mensterilkan tubuh dari berbagai macam campuran yang buruk menurut biologis dan hukum syara said ibnu jubair telah mengatakan bahwa barang siapa yang puasa bulan ramadhan dan tiga hari setiap bulannya maka ia termasuk apa yang disebutkan oleh allah subhanahu wa taala di dalam firmannya lakilaki dan perempuan yang berpuasa alahzab sesungguhnya lakilaki dan perempuan yang muslim lakilaki dan perempuan yang mukmin lakilaki dan perempuan yang tetap dalam ketaatannya lakilaki dan perempuan yang benar lakilaki dan perempuan yang sabar lakilaki dan perempuan yang khusyuk lakilaki dan perempuan yang bersedekah lakilaki dan perempuan yang berpuasa lakilaki dan perempuan yang memelihara kehormatannya lakilaki dan perempuan yang banyak menyebut nama allah allah telah menyediakan ampunan dan pahala yang besar untuk merekaal ahzab,5
tempatnya bagustiket masuknya murahcocok untuk menenangkan diri,5
ok,5
tempatnya sangat bagus,5
sebuah taman batu yg eksotis penampilan alami bebatuan berpadu dgn hutan pegunungan ditambah latar belakang puncak gunung sepikul menghadirkan nuansa bak lukisan berbagai pesona alamdapat anda nikmati dlm satu tempat ini ada gua labirin batu jembatan gantung niagara mini rumah batu dan tentu saja udara dan pemandangan segar ada tebing batu yg berceruk seperti tampilan dinding pantai yg terkikis ombak sehingga timbul fantasi mungkinkah pegunungan ini beribu atau berjuta tahun yg lalu adalah samudra tiket dan parkir sangat murah demikian juga aneka minuman yg tersedia di warung seputar lokasi jika ingin diantar pemandu ada petugas yg siap mendampingi dan membatu anda berfoto ria dgn tarif sukarela selamat mensyukuri nikmat keindahan ciptaan allah,4
baguss bangettt ini kalo di daerah yang mudah di jangkau pasti bakal ramee bgt tempatnya bersih adem jalannanya nanjak tp masih bisa dijangkau enak buat hilingg areanya gedee dan lumayan capek buat explore seluruh tempat minusnya ada beberapa goa bebatuan yang dicoret coret,4
perlu perawatan,4
jalan menuju lokasi lumayan menanjak pendek pas di lokasi keren bangett masuk byr buka jam,5
kearifan lokal yg indah dan ramah,5
lokasi mudah dijangkau good view sudah sepi wisatanya lumayan buat refreshing pikiran jalan sama alam,5
lokasinya lumayan jauh dari pusat kota trenggalek tempat wisatanya bagus cuma sepi pengunjung banyak spot foto yang menarik dengan latar belakang batubatuan yang alami dan eksotis serta gununggunung cuma tempatnya seperti kurang terawat mungkin perlu ditata lebih baik dan digencarkan promosinya untuk tiket masuk harganya murah,4
eksotis,5
tiketnya murah ribu pemandangan menarik dan menajub kanyang penting hati hati jalan naik turun tangga yang sempit dan agak curam,5
kurang menarik karna mungkin minimnya anggaran dr pemkab untuk mengembangkan destinasi wisata goa ngerit perlu penataan yg apik dan promosi yg menarik melalui website dan media sosial lainnya maaf ini pendapat dan saran pribadi saya aja,3
kenapa sekarang sepi,3
goa ngerit dibalik cerita yang melegenda tentang tempat ini tersimpan detail detail keindahan yang menawan perpaduan antara bebatuan pepohonan rumput bunga dan yang lainnya mampu membawa kita kedalam ketenangan jiwa parkiran sangat luas harga tiket masuk hanya ribu hari biasa dan ribu akhir pekan banyak spot untuk foto tersedia bangsal untuk kita duduk duduk menikmati pemandangan,5
tampak alami,4
lumayan bagus sii cuman sepi pengunjung usahakan kalau datang kesini dalam keadaan kondisi kaki yg sehat karena jalannya full bebatuan naikturun,4
jozzz,5
ngerit stone park tadi kesini pinggir jalan dan parkiran mobil luas jalan kampak arah sebo watulimo jalan cukup nanjak lebih nanjak dari pas kmrn di tawangmangu yg di jln lama pulang dari nava hotel dl tp seru kudu fokus dan gigi jika pas tanjakan lanjut sampe sebo watulimohehhee bs lanjut ke pantai pasir putih prigi alhamdulillah lancar sip tau goa ngerit drel drelsona tulungagung perawatan kecantikan,5
yahhaahuaha,5
cakep sih view nya tapi jalannya juga berkelok turunan dan mendaki yang suka alam pasti suka,5
bagi yang ingin merasakan pengalaman menyusuri batu batuan seperti di film film taman jura disinilah tempatnya,5
tempat yang keren,3
bisa nyantai,2
tempat wisata yg representatif untuk di kunjungi,2
tempat wisata cukup menarik,5
datang kesana jam sore udah tutup akhirnya selfi di parkiran,5
bagus banget tempatnyaa kalo ke trenggalek jawa timur harus mampir ke wisata ini sii yaaa,5
bagus bgt utk keluarga,5
mantap buat olahraga,5
wisata alami yang musti didatangi,5
bagus banget,5
cukup menyenangkan ini pengalaman terbaru saya dengan nuansa yang berbeda,4
buat penumpang puasdalam berwisata alhamdulillah,3
alami sarana prasarana lengkap,5
yempatnya masih alami sejuk indah asri monggo mampir,5
recommended buat yg kepingin ngadeem,5
tiketnya terjangkau adem banget disana bagus buat fotofoto juga nah kalau laper gausah khawatir karena dibawah itu ada warung kok tempatnya nggak terlalu curam tapi kalau hujan lumayan licin batunya,5
mantap sarana dan prasarana komplit bersih safety alami,5
adeeeemmm,5
sip,5
uang masuk rp saja,4
suasana alam yang sangat asri sangat menyenangkan untuk berwisata kawasan wisataolahraga,5
htm nya berapa ya untuk rombongan anakanak sekolah bisa bantu,5
indah n nyaman,4
sangat indah dengan pemandangan yang begitu sangat indahsuasana yang menyenangkan,1
nssmith ni bos,5
bagus tempatnya,5
indah mempesona,5
ikonik,5
cukup bagus ga sia sia perjalanan jauh,5
goa ngerit beautiful place and family walks,3
eksotik alami dan indah sekali,5
mantap,5
jngn sampai ketinggalan berwiata ke goa ngerit,1
bagus natural memicu adrenalin,5
tempatnya bagus htm terjangkau hanya saja j bukanya rancu dan kadang tidak ada yg jagaa,5
apa sudah buka ya,4
tempatnya masih alami,1
capek tapi seruuu lumayanlah buat refreshing back to nature,5
so fantastik,5
lumayanlah,4
goa ngerit merupakan goa yg terbentuk secara alami terdapat keunikan tersendiri pada lokasi ini tempat rekreasi dan belajar yang bagus utk kaum muda dan anakanak,5
wisata yg bagus,5
menarik tempat nya unik penuh misteri,4
ini,5
belum pernah masuk sejak direnov,3
tempat santai rerdekat dari rumah,5
pemandangannya baguscuman akses jalan menuju goa ngerit agak ektrim perlu berhati,5
bagus buat liburan keluarga,5
ih wajib banget buat kalian yang dari luar trenggalek,5
sejuk asri asik tapi sayang jalannya sempit dan agak licin jadi harus hati kalau jalan be careful,3
bagus lokasinya sangat asri jika bersama keluarga tempatnya masih alami dan udaranya fresh,5
cakep biangett sihh nggk kecewa,5
gimana pak kbrnya,4
tempatnya indah nan sejuk,4
kerennn,5
tidak terawat,1
joos masih natural alami perlu di jaga,5
indahnya ciptaanya sungguh kerennnnasiikk pokooknya main kesana,5
mantap pemandangannya luar biasa,5
tempat nya sangat indah sejuk goa yang eksotis dech makanan juga ada sip pokok nya,5
tempat wisata dekat rumah yang murah meriah lumayan untuk cuci mata,5
tempatnya indah dan bersih,5
asyik medannya,5
tempat wisata alam yang sangat bagus jalan jalan di sini sama dengan olah raga boss naik turun tebing,5
bagus,5
udara segarcocok untuk wisata keluarga,3
tempat yg indahsejuuukrindangallah maha besar,4
tempat oke,5
goa yg sangat indah,5
jalur mantapcocok buat sepedahan,5
menakjubkan,5
keren banget tempat ini dibuat sedemikian rupa memanfaatkan batu alam agar jadi labirin pokoknya recommended buat liburan bareng,5
pemandangan asri medan cukup extream untuk sampai sungai dibawah but so far its worth it,4
tempat yg bagus untuk cuci mataaa airnya lagi tidak deras sejuk dan seru untuk wisata gua,5
exotis banget goa dengan tebing yg sangat indah bersih ada sungai yg alirannya masuk kedalam bumi maa syaa alloh luar biasa,4
tempatnya indah,4
wisata yang indah dan edukatif sejuk luas banyak spot foto tersedia warung makan minuman cocok untuk refreshing sendiri maupun keluarga,5
indah nan sejuk,5
parkir luas kebersihan area terjaga oke pokoknya yang luar kota jangan lupa mampir kesini kalo ke trenggalek,5
cocok untuk keluarga,4
tempat yang pas buat foto,5
bagus lah tempatnya syg panas bgt udaranya,4
suasana nya adem goanya banyak juga harus pinter nyari spot foto usahakan teman kamu pinter dalam pengambilan foto,4
wisata yg indah perlu promosi dr agar lebih dikenal,5
bagus banget,5
so beautiful,5
sangat menarik dgn keindahan alam nya tempat ini jg merupakan situs purbakala,4
mantaf jiwa,5
sangat indah untuk dikunjungi oleh para wisatawan,5
bagus tempatnya kaya kembali ke jaman purba,4
indah bgt,5
dr sini kita bisa liat sejarah putri dr sebuah kerajaan yg lagi bertapasehingga jd saktiwelas asihpokok ad unsur sejarah nyjd qt gag hnya jalan dr sini qt bisa bljar sejarah masa laluaseekk utk di kunjungi,5
istimewamasih asri n alamicocok buat merecharge energi di selasela kepadatan rutinitas,5
adem banget kalo kesini kalian bisa dpt spot foto banyak yg bagus bagus dan plusnya bisa sekalian olahraga,5
menyenangkan awale agak takut juga tapi ternyata asyik,5
ngerit stone parkbagus dan indah pemandangannyaalami dari alam,5
lumayan nyaman buat liburan,4
tenpatnya seru,5
cukup bersih n asrimungkin perlu tambahan utk tempat main anak dan jg perlu depotwarung makan,5
kerenn,4
rapi,4
tempatnya sejuk masih alami,4
cilok dan sodanya enak,5
sangat indah posisi dekat pegunungan,4
masih alamisejuk dan hening,3
